{
  "schema_version": "1.0.0",
  "record_id": "asset:sample.orders-service",
  "asset_type": "runtime-component",
  "version_scope": {
    "product_version": "sample-build-1",
    "scope_or_module": "scope:sample.orders",
    "environment_id": "environment:sample.lab",
    "valid_from": "2026-01-15T09:00:00Z",
    "valid_to": null
  },
  "source": {
    "source_id": "source:sample.inventory",
    "locator": "controlled://sample/assets/orders-service",
    "content_hash": "sha256:1111111111111111111111111111111111111111111111111111111111111111"
  },
  "classification": "synthetic",
  "reachability": "runtime-observed",
  "integrity": {
    "hash_applicability": "required",
    "content_hash": "sha256:2222222222222222222222222222222222222222222222222222222222222222",
    "not_applicable_reason": null
  },
  "status": "active",
  "owner": "Sample technical analyst",
  "validation_method": {
    "method_id": "method:sample.asset-hash-check",
    "description": "Compare the controlled artifact hash with the recorded value.",
    "reproducible": true
  },
  "last_updated": "2026-01-15"
}
